{
  "version": "v1",
  "requiredKeys": [
    "AUTHZ_PDP_MODE",
    "HIS_HOPE_ENVIRONMENT",
    "HIS_HOPE_RUNTIME_CONTRACT_VERSION",
    "HIS_HOPE_PUBLIC_API_ORIGIN",
    "HIS_HOPE_PUBLIC_WEB_ORIGIN",
    "HIS_HOPE_PUBLIC_ADMIN_ORIGIN",
    "HIS_HOPE_PUBLIC_DASHBOARD_ORIGIN",
    "HIS_HOPE_OIDC_AUTHORITY",
    "HIS_HOPE_SECRET_PROVIDER",
    "HIS_HOPE_SECRET_PROVIDER_REF",
    "SERVICE_API_GATEWAY_URL",
    "SERVICE_IDENTITY_URL",
    "SERVICE_PATIENT_URL",
    "SERVICE_APPOINTMENT_URL",
    "SERVICE_CLINICAL_URL",
    "SERVICE_LAB_URL",
    "SERVICE_BILLING_URL",
    "SERVICE_PHARMACY_URL",
    "SERVICE_FHIR_GATEWAY_URL",
    "SERVICE_DASHBOARD_BFF_URL",
    "SERVICE_DATABASE_CONTINUITY_URL",
    "DATABASE_POSTGRES_URL",
    "REDIS_URL",
    "RABBITMQ_URL",
    "RESILIENCE_HTTP_TIMEOUT_SECONDS",
    "RESILIENCE_HTTP_RETRY_COUNT",
    "OBSERVABILITY_OTEL_EXPORTER_OTLP_ENDPOINT",
    "OBSERVABILITY_PROMETHEUS_URL",
    "OBSERVABILITY_LOKI_URL",
    "OBSERVABILITY_ALERTMANAGER_URL",
    "OBSERVABILITY_PROMETHEUS_REQUIRED",
    "OBSERVABILITY_ELASTICSEARCH_URL",
    "OBSERVABILITY_ELASTICSEARCH_REQUIRED",
    "OBSERVABILITY_JAEGER_URL",
    "OBSERVABILITY_JAEGER_REQUIRED",
    "SECRET_POSTGRES_PASSWORD",
    "SECRET_POSTGRES_PASSWORD_REF",
    "SECRET_RABBITMQ_PASSWORD",
    "SECRET_RABBITMQ_PASSWORD_REF",
    "SECRET_REDIS_PASSWORD",
    "SECRET_REDIS_PASSWORD_REF",
    "SECRET_OIDC_CLIENT_SECRET",
    "SECRET_OIDC_CLIENT_SECRET_REF",
    "DEVICE_POSTURE_MODE",
    "DEVICE_POSTURE_PROVIDERS",
    "DEVICE_POSTURE_TTL_SECONDS",
    "DEVICE_POSTURE_ENFORCE_CLINICAL",
    "PASSWORD_HISTORY_ENABLED",
    "PASSWORD_HISTORY_COUNT",
    "AUDIT_APPEND_ONLY",
    "AUDIT_REDACTION_ENABLED",
    "EXTERNAL_FEDERATION_ENABLED",
    "SCIM_M2M_ENABLED",
    "PROVISIONING_MODE",
    "PROVISIONING_TARGETS",
    "SSF_ENABLED",
    "MTLS_ENABLED",
    "RADIUS_EAP_TLS_ENABLED",
    "CSV_EXPORT_ENABLED"
  ],
  "publicOrigins": [
    {
      "key": "HIS_HOPE_PUBLIC_API_ORIGIN",
      "kind": "public-origin",
      "logicalName": "public-api-origin",
      "uriSchemes": [
        "http",
        "https"
      ],
      "strictRuntimeMatch": false,
      "allowLocalhostInProduction": false,
      "runtimes": {
        "docker": {
          "host": "localhost",
          "port": 5000
        },
        "vm": {
          "host": "api.staging.his-hope.example",
          "port": 443
        },
        "kubernetes": {
          "host": "api.his-hope.example",
          "port": 443
        }
      }
    },
    {
      "key": "HIS_HOPE_PUBLIC_WEB_ORIGIN",
      "kind": "public-origin",
      "logicalName": "public-web-origin",
      "uriSchemes": [
        "http",
        "https"
      ],
      "strictRuntimeMatch": false,
      "allowLocalhostInProduction": false,
      "runtimes": {
        "docker": {
          "host": "localhost",
          "port": 4200
        },
        "vm": {
          "host": "app.staging.his-hope.example",
          "port": 443
        },
        "kubernetes": {
          "host": "app.his-hope.example",
          "port": 443
        }
      }
    },
    {
      "key": "HIS_HOPE_PUBLIC_ADMIN_ORIGIN",
      "kind": "public-origin",
      "logicalName": "public-admin-origin",
      "uriSchemes": [
        "http",
        "https"
      ],
      "strictRuntimeMatch": false,
      "allowLocalhostInProduction": false,
      "runtimes": {
        "docker": {
          "host": "localhost",
          "port": 4201
        },
        "vm": {
          "host": "admin.staging.his-hope.example",
          "port": 443
        },
        "kubernetes": {
          "host": "admin.his-hope.example",
          "port": 443
        }
      }
    },
    {
      "key": "HIS_HOPE_PUBLIC_DASHBOARD_ORIGIN",
      "kind": "public-origin",
      "logicalName": "public-dashboard-origin",
      "uriSchemes": [
        "http",
        "https"
      ],
      "strictRuntimeMatch": false,
      "allowLocalhostInProduction": false,
      "runtimes": {
        "docker": {
          "host": "localhost",
          "port": 4202
        },
        "vm": {
          "host": "ops.staging.his-hope.example",
          "port": 443
        },
        "kubernetes": {
          "host": "ops.his-hope.example",
          "port": 443
        }
      }
    },
    {
      "key": "HIS_HOPE_OIDC_AUTHORITY",
      "kind": "oidc-authority",
      "logicalName": "oidc-authority",
      "uriSchemes": [
        "http",
        "https"
      ],
      "strictRuntimeMatch": false,
      "allowLocalhostInProduction": false,
      "runtimes": {
        "docker": {
          "host": "localhost",
          "port": 5001
        },
        "vm": {
          "host": "identity.staging.his-hope.example",
          "port": 443
        },
        "kubernetes": {
          "host": "identity.his-hope.example",
          "port": 443
        }
      }
    }
  ],
  "serviceEndpoints": [
    {
      "key": "SERVICE_API_GATEWAY_URL",
      "kind": "service-url",
      "logicalName": "api-gateway",
      "uriSchemes": [
        "http"
      ],
      "strictRuntimeMatch": true,
      "allowLocalhostInProduction": false,
      "runtimes": {
        "docker": {
          "host": "api-gateway",
          "port": 5000
        },
        "vm": {
          "host": "gateway.internal.staging.his-hope.example",
          "port": 5000
        },
        "kubernetes": {
          "host": "api-gateway.his-hope.svc.cluster.local",
          "port": 5000
        }
      }
    },
    {
      "key": "SERVICE_IDENTITY_URL",
      "kind": "service-url",
      "logicalName": "identityservice",
      "uriSchemes": [
        "http"
      ],
      "strictRuntimeMatch": true,
      "allowLocalhostInProduction": false,
      "runtimes": {
        "docker": {
          "host": "identityservice",
          "port": 5003
        },
        "vm": {
          "host": "identity.internal.staging.his-hope.example",
          "port": 5001
        },
        "kubernetes": {
          "host": "identity-service.his-hope.svc.cluster.local",
          "port": 5003
        }
      }
    },
    {
      "key": "SERVICE_PATIENT_URL",
      "kind": "service-url",
      "logicalName": "patientservice",
      "uriSchemes": [
        "http"
      ],
      "strictRuntimeMatch": true,
      "allowLocalhostInProduction": false,
      "runtimes": {
        "docker": {
          "host": "patientservice",
          "port": 5002
        },
        "vm": {
          "host": "patient.internal.staging.his-hope.example",
          "port": 5002
        },
        "kubernetes": {
          "host": "patient-service.his-hope.svc.cluster.local",
          "port": 5002
        }
      }
    },
    {
      "key": "SERVICE_APPOINTMENT_URL",
      "kind": "service-url",
      "logicalName": "appointmentservice",
      "uriSchemes": [
        "http"
      ],
      "strictRuntimeMatch": true,
      "allowLocalhostInProduction": false,
      "runtimes": {
        "docker": {
          "host": "appointmentservice",
          "port": 5003
        },
        "vm": {
          "host": "appointment.internal.staging.his-hope.example",
          "port": 5003
        },
        "kubernetes": {
          "host": "appointment-service.his-hope.svc.cluster.local",
          "port": 5004
        }
      }
    },
    {
      "key": "SERVICE_CLINICAL_URL",
      "kind": "service-url",
      "logicalName": "clinicalservice",
      "uriSchemes": [
        "http"
      ],
      "strictRuntimeMatch": true,
      "allowLocalhostInProduction": false,
      "runtimes": {
        "docker": {
          "host": "clinicalservice",
          "port": 5004
        },
        "vm": {
          "host": "clinical.internal.staging.his-hope.example",
          "port": 5004
        },
        "kubernetes": {
          "host": "clinical-service.his-hope.svc.cluster.local",
          "port": 5005
        }
      }
    },
    {
      "key": "SERVICE_LAB_URL",
      "kind": "service-url",
      "logicalName": "labservice",
      "uriSchemes": [
        "http"
      ],
      "strictRuntimeMatch": true,
      "allowLocalhostInProduction": false,
      "runtimes": {
        "docker": {
          "host": "labservice",
          "port": 5010
        },
        "vm": {
          "host": "lab.internal.staging.his-hope.example",
          "port": 5010
        },
        "kubernetes": {
          "host": "lab-service.his-hope.svc.cluster.local",
          "port": 5010
        }
      }
    },
    {
      "key": "SERVICE_BILLING_URL",
      "kind": "service-url",
      "logicalName": "billingservice",
      "uriSchemes": [
        "http"
      ],
      "strictRuntimeMatch": true,
      "allowLocalhostInProduction": false,
      "runtimes": {
        "docker": {
          "host": "billingservice",
          "port": 5020
        },
        "vm": {
          "host": "billing.internal.staging.his-hope.example",
          "port": 5020
        },
        "kubernetes": {
          "host": "billing-service.his-hope.svc.cluster.local",
          "port": 5020
        }
      }
    },
    {
      "key": "SERVICE_PHARMACY_URL",
      "kind": "service-url",
      "logicalName": "pharmacyservice",
      "uriSchemes": [
        "http"
      ],
      "strictRuntimeMatch": true,
      "allowLocalhostInProduction": false,
      "runtimes": {
        "docker": {
          "host": "pharmacyservice",
          "port": 5030
        },
        "vm": {
          "host": "pharmacy.internal.staging.his-hope.example",
          "port": 5030
        },
        "kubernetes": {
          "host": "pharmacy-service.his-hope.svc.cluster.local",
          "port": 5030
        }
      }
    },
    {
      "key": "SERVICE_FHIR_GATEWAY_URL",
      "kind": "service-url",
      "logicalName": "fhir-gateway",
      "uriSchemes": [
        "http"
      ],
      "strictRuntimeMatch": true,
      "allowLocalhostInProduction": false,
      "runtimes": {
        "docker": {
          "host": "fhir-gateway",
          "port": 5040
        },
        "vm": {